1,"台北市東區 公車就可以到達的登山步道全程走完約一個半小時, 步道規劃維護的很好  "
1,解籤人員不知道在沒耐心什麼？ 感覺就像不專業的  
1,很無言，網路查資料寫8：00開門，8:15分到 門口寫9：00才開放，不值得到訪  
1,服務：跟服務人員說要借一步討論，但服務員依舊在旁邊聽我們討論，很沒有隱私感，然後服務人員在討論的過程中插話推薦點什麼點什麼，有點沒有禮貌   服務人員一直要我們點整瓶紅酒，但我有告知說身體不方便，但還是一直推紅酒，覺得說有點不尊重客人，沒有把客人的身體當回事   價格：雞翅三隻180$感到非常的驚訝，現在雞翅都這麼貴了嗎   將入餐廳強迫低消450$，只聽音樂會400$的話，照常要低消，花了快一千，但感覺CP值不高，餐廳沒有到很好吃，份量很少，然後服務人員態度沒有很好  
1,  人太多了……有聲書的解釋太冗長了。   有很多地方不存在，因為導遊的人都在外面露營，所以很難看到受歡迎的作品。   在一樓櫃檯打車，我寫下來確認是台北市站，但司機帶我到總站……出租車司機好像不會看谷歌地圖。      
1,  ala我想問嗎？   我有一個回教堂，我想去清真寺，但我不知道它在哪裡，我的房子在宜蘭很遠，我可以把它轉移給infaq嗎？ k      
1,雖然展覽很好但是志工勸導態度非常差！  
1,破舊，沒有妥善保養，看起來沒人重視，文化局在幹嘛？  
1,鄰近市場雖然很方便 但是周遭攤販佔據人行道擺攤 人行道上很多抽菸的人 還有喝酒的  
1,對集乳媽媽不友善的環境。園區只有哺集乳室，未提供冰箱保存母乳，但不是哺乳期的媽媽去華山都一定帶著小孩當場餵，特別是因臨時性工作在園區待上數小時，無冰箱真的很不方便。   此次才知，同個園區是分三個場管單位，一般遊客服務是台灣文創公司負責，而華山小客廳與光點華山電影館是否有哺乳室與冰箱，需自行詢問，台灣文創不清楚。整個橫向連結很差，非常方便。  
1,2022.6.19 約17:00      在靠捷運站內的政治／歷史區，向一名髮色淺棕色、如男性短髮的女店員詢問書籍，收到的回應態度極差像是被訓話，且她表示這本書不是她負責的區域，然後直接被趕走，顧客體驗極差。  
1,停車超不方便！明明就有車子出來也無法排隊進場...拼命趕人離開...  
1,就是以前灌溉水溝沒什麼特色。  
1,好天氣到碧山嚴走走拜拜。  
1,對歷史的解說與評價僅有一面之詞，完全被當作政治工具使用  
1,50塊沒什麼東西可逛，購票前急著收門票，後來發現自己符合優惠資格以後他也不會退錢。經營的普普通通，陳設也不太像林語堂以前原居  
1,某些店家在網路上po商品，去到實體店面根本沒貨，有被騙的感覺  
2,没有飛機劃過頭頂的震撼感  
2,就是觀光夜市 沒什麼特別的   蠻擠的 很多吃的沒標記價格  
2,學生可以一人佔30個位子，面紙一小張也可以佔位子，不讓外來人有任何機會。老師很好，助教很好。覺得老師在這裏，除了高薪之外，應該會受很多學生的氣。  
2,展覽區域不大，能展示的東西太少  
2,※整體環境、設計風格顯著且舒適。在消費上就是要你多花不少錢～      ※會計人員頗兩光，上過的課程金額算錯（少算）而且還是隔了好幾天才跟我聯繫說算錯還把多給的點數扣回= =      ※某次因工作需要了解看展，（同事一直主動聯繫對方）負責的公關員回覆跟聯繫可以拖到兩個星期後才以模糊的理由婉拒，在這之前陪同是去看展時發票是給工讀生開的，這不打緊但還可以開錯兩次讓同事多跑幾趟（雖然離公司不遠但觀感很差）（另外也是有熱心的工作人員）      ※以前去聽日本的字體設計師的講座，翻譯人員講到後來直接請台下的設計師書籍翻譯來幫他翻譯，用心程度令人汗顏。（功課沒有做足）      ※課程部分價格高，且不會事先特別說明課程內容或是適合什麼樣的人去上課（網頁只會說的很大概，但想知道更進階的細項無從諮詢，服務人員無法完全了解，甚至有些是工讀生）      餐廳部分價格過高，強調有機跟當地特殊食材，調理普通整體想要營造精緻的感覺，如果只是想要去吃氣氛、想要有大一點的座位空間可以去吃～  
2,  過去，薰衣草和波斯菊遍布公園後方，但現在卻是一片荒原。對不起   前景中的公園很美      
2,  曾經真的很喜歡這個地方。現在感覺雜亂無章，時尚過時。變得更貴了。      
2,人山人海的，一個排骨便當220元貴鬆鬆，走去北車買就好了  
2,花季公車搭乘地點有變卻沒在公車亭寫害人白等  
2,售票口超級難找，來了好幾次都要多繞好幾圈，本來以為是我路癡結果問了朋友發現大家也覺得很難找。   會員購票50元，報電話就可以了，售票櫃員有待加強不知道是吃了什麼SOP硬要叫人掃前方QRcode 說掃了有看到會員就是會員，但是大小姐啊沒cookies沒記住的話進入就是註冊頁面，我甚至還沒登入當然吃不到資料啊。   再做一堆好想很漂亮的東西之前先把基本的流程先搞定了好嗎？整個signage design亂無章法，不是掛著設計名號就覺得自己好棒好嗎  
2,來看江雲之間4/4週日下午場次，   非常感謝取票的服務台小姐親切熱心提供協助。      但門口量體溫的人員面無表情+指令給得一板一眼（讓人感覺像犯人...），真心建議請語帶柔和、面帶微笑。      看完了離場後才想到忘了拿午餐，折返時在入口處只是禮貌詢問，但灰色制服的兩位小姐的態度頗讓人有「禁止硬闖」之感。之後有另一位服務人員帶著我的午餐走出來，還對我皺眉頭  
2,它是三級古蹟，但是它是私人民宅，不能隨意進入參觀，只能在外面觀賞拍照。  
2,  文昌寺是有孩子在校讀書的父母前來祈求好運的熱門場所。      
2,  翡翠是外國人難以理解的寶石。   好與壞..我不知道為什麼它必須很貴。   注意   中國雲南省麗江是一個盛產玉石的地方。   住在那裡會怎樣？      
2,  雞尾酒並沒有給我留下深刻的印象（杜松子酒和湯力，配以超大酒杯中的橙片），食物也很糟糕（湯不溫不火，羊排冷食，骨頭上絕對沒有肉，隨機分類在一堆土豆泥裡夾著“麵包”的蔬菜，全部放在一個盤子裡，在我朋友的菜上菜後大約十分鐘才上菜）。上面寫著“1930s”的 2 米鐘看起來像是有人在網上為萬聖節買的派對裝飾品。他們甚至沒有牛排刀。這裡的一切都是假的，但最糟糕的是，看起來他們甚至都沒有試圖說服我們它不是。      
2,不怎麼適合親子同遊，有一些流浪漢，B2是算命街，B3有一些動漫的商店，整體來說應該不會再去第二次  
2,這條步道所經過的水域雖然沒有明顯的髒亂，但水質依然堪憂，水的顏色呈現詭異的粉藍綠色，透光度非常差，水裡面魚沒幾隻，也幾乎沒有水生植物，使得岩石表面的黃色特別突出，整條溪流死氣沉沉，就只差沒有飄出奇怪的味道了。   步道途經的山林也缺乏生物生存，感覺受到人類干擾太嚴重，山裡面迴盪著圓覺寺所播放的佛經，有種被強迫收聽的感覺，我想不只人們會認為這使得空氣瀰漫著一股詭譎的氣氛，連動物們都會不堪其擾，搬家了事吧。   看到有人在那溪邊戲水，我真的很懷疑他們是不是沒看過乾淨的水長怎樣，他們最好小心身體健康，那佛經唸來唸去唸到整個生態都毀滅了。  
3,北投地區對於這種大眾免費的設施都規劃得很用心，還有用來沖腳的自來水及置物的櫃子，只是這個地點在Google導航上面有點奇怪， 直接導航到上面的思源路再開下來，開下來的路非常小，還是建議停在上面的路邊比較安全。  
3,  夜市的長度很短。你很快就會走路了。馬路不是行人天堂，汽車摩托車飛過，走路很危險。那些有孩子的人不應該讓他們的手無人看管。食物是當地的而且價格合理。夜市周圍有很多食品和飲料店，所以在該地區漫步會很有趣。      
3,"來回大概半個小時的路程,相當輕鬆,可以看到新光大樓及101大樓  "
3,  一個非常安靜和平靜的寺廟，具有當地信仰的氛圍。   就在龍山寺旁邊。   有廁所。      
3,  傳統的小寺廟，就是這樣！轉而去龍山寺      
3,路平、夜晚燈具通明…   人多…但小孩四處亂竄、很危險。  
3,可能因為季節緣故 沒有水  
3,遊樂設施很好玩，沙坑也不錯，美中不足的是遮陽設施不好，四月去玩還可以，夏天大概就沒辦法在艷陽下玩設施了。  
3,外觀很有日據時代懷舊典雅，但門口設計已不適合現車多的現今，尤其每當回診對行動不便坐輪椅的病患和陪伴者都很辛苦，斜坡推上總是擁擠在轉角處，連出來也是和行人擠在一起，感覺動線很不理想！  
3,爬山休息點也可泡茶聊天看大台北101  
3,人潮很多，有吃的，還有休閒泡茶店好幾家外面有些中年女士穿著清涼牌牌坐感聚覺不對有損萬華形像  
3,巷弄裡有小店可以逛逛   有些食物不錯吃   假日公園會有人表演   覺得逛逛一個小時沒問題再長就還好  
3,威權時期的產物 看看就好其實現在把它當旅遊點也還算不錯  
3,如果跟商家發生爭執，服務台很給力，可以找他們協商。   不過有些店家的行徑不大合理（攤商附圖如下）：   本人到玉市買玉鐲，老闆掛保證說玉鐲一定戴的上，但拒絕幫本人戴，說自己回去用肥皂水戴就行了，但本人回家試了三個小時，玉鐲太小戴不上，還弄傷了手（已經試過很多網路上的方法）。   隔天去找他退錢被拒絕，他說：「不然我幫你戴，如果妳手受傷爛掉斷掉自己負責！簽保證書！」並且說我「野蠻」，雖然最後成功退錢，但個人還是不大喜歡這次購物經驗。   這個攤位的老闆是一個身形瘦削，眼睛大，有時會罵客人，語氣有些衝的老爺爺還有他老婆。   以上提供自己的經驗供消費者作為購物時的參考，誠摯提醒，如果要買自己戴的玉鐲，建議題現場試戴，不然遇到老闆事前掛保證，出事後又拒絕退款，程序上會有點麻煩。  
3,  在早市街中間的神社。規模很小。許多奉獻的平板電腦被顯示為功課的上帝！      
3,內部空間塞滿展示資料和破壞原有空間氛圍的無謂裝修，外皮是無法近看的假仿面磚，地面竟然鋪設比外圍制式步道還不像樣的材質。   本地目前最好的古績修繕工事就這種水準而已。新不一定比較好，而文化也還分高低呢，一切都還差得遠。  
3,鬧中取靜，散心好地方。可惜小黑蚊太多了，影響參觀心情  
4,天后宮是供奉媽祖的廟宇，如果你有在台灣到處走走就可以發現台灣到處都是媽祖廟，算是台灣蠻大的信仰對象。  
4,台北人喜歡的美食夜市，日本人也很常來  
4,台北鬧區中的桃花源，交通方便易達。  
4,清涼的地方，走親子步道的休息區之一  
4,  如果你有時間，請把它放在你的日程表中......不管台北是否必須和首要任務。      
4,從自行車步道下來，沿著河岸邊散步欣賞繁華大稻埕外的寧靜世界  
4,很富教育意義的歷史景點，公車總站下車後繼續往挹翠山莊方向走，很快就會發現指標，亦可經由此景點續登象山。  
4,台灣眾多廟都列入古蹟，惠濟宮也不例外，列為三級古蹟，廟前廣場可遠眺台北都會區，微風吹拂很適合散心及走完登山步道來這裡小憇一下，很是放鬆  
4,乾淨美麗，距離遊客中心很近。  
4,呈現早期茶行家族經營模式，家族生活環境工廠分配，因應大環境改變，順應潮流調整商業模式，連建築房地都擴展經營，十足的生意人頭腦，令人讚賞！  
4,建築優美，空間寬廣，身處其中心思寧靜。  
4,這邊的導覽很盡心盡力，他們解說的很詳細，好像要把所有航海和船的資訊一下子交給小孩，耐心又很有愛心，場內環境佳，互動性也強，最後也看到鐵達尼號如何沈船的 。這真的很棒的校外教學地點。聽說他們的餐廳也很棒，而且還有積木DIY，這樣的行程真是太好了。但美中不足是停車不易，孩子需要過大馬路，還蠻危險的，但先聯絡長榮海事，他們都會派人出來幫忙引導，也是貼心的服務。  
4,敬奉 玉皇大帝恩主公，心誠則靈  
4,東西不錯吃 夜市環境差一點  
4,以規模推斷是當時的頂級豪宅  
4,#LocalGuides   2017大年初二之三宮巡禮第1站，主神 - 福德正神!  
4,充滿草藥芳香的一條小巷子  
5,都會的後花園，很有知識性和教育性  
5,這裡環境很好   歷史悠久   每次來都有一種很開心的感覺  
5,歪腰郵筒，是臺灣臺北市中山區兩個遭到颱風蘇迪勒侵襲而掉落的招牌砸歪的郵筒，由於其造型可愛而獲得民眾的高度關注。之後中華郵政響應民眾的要求而同意考慮將歪斜的郵筒予以保留，並且進一步發展成為臺北市另類景點[1]。在考量週遭民眾安全和交通狀況，決定將歪腰郵筒遷移至臺北郵局。但是計畫遷移的舉動則受到許多民間人士反對，前中華民國文化部部長龍應台更批評中華郵政不懂其價值。之後中華郵政則順應社會大眾意見而暫緩遷移工作，並且計畫之後與專家學者共同討論  
5,  由於18世紀西班牙神父的早期歷史，天主教是這裡最早的宗教之一。   這個建於60年代，其目的是在野外建造一個神聖的帳篷。   但你不會相信我們放置的距離只有一個街區......   就在天主教堂旁邊，我們有......一個清真！這有趣嗎？在台北，我們對宗教一般都非常冷淡。   這個國家不是建立在宗教的基礎上的，歷史上宗教很少是戰爭的原因。您可以通過當地免費步行遊覽“台北休閒之旅”了解更多有關該地區的信息。      
5,  如果店主的祖母喝了充滿誠意的茶，那麼您一定會買的，而且可以買到比街對面的ims商店便宜一些的茶。我參觀了幾家茶館，但它是一家友好而友好的商店，我從東方美人，大原嶺，麗山，林業...到Sagyeonchun購買了很多茶。      
5,休閒娛樂 的 好去處 很棒 值得一遊  
5,50元就能看到國內外藝術品，很划算！   每次展覽的票都會做不一樣的樣式，紙本或是塑膠甚至磁鐵材質都有可能，值得收藏   主展覽看完，還能免費看另外一到二項展覽  
5,超好玩，更認識台灣了，再來1⃣️次  
5,不只是圖書館！門票大人80元 可以一天內憑卡進出！要脫鞋 飲料食物也不能帶進去 門口左邊有可以放鞋子的 購票在裡面！整個環境令人喜愛 雜誌和設計書籍眾多 有可以隨意坐著看書的區域 也有可以用筆電辦公的地方！  
5,裡面可以說是別有洞天！二樓的禮拜堂很令人驚艷，教會以遵循傳統的唱詩班聞名，和一般的教會很不一樣。  
5,  尼斯歷史悠久的地方。語音導覽相當不錯。      
5,亲爱的朋友们，我是土耳其人出售的沙威玛，我将于明天6.10.2020开始工作。祝你们好运，并希望我能与大家见面。 dear friends it's me mobeen the Turkish selling shawarma I will start my work tomorrow 6.10.2020 I wish you guys good luck and I wish I can meet everyone..          親愛的朋友們，我是土耳其人出售的沙威瑪，我將於明天6.10.2020開始工作。祝你們好運，並希望我能與大家見面。 dear friends it's me mobeen the Turkish selling shawarma I will start my work tomorrow 6.10.2020 I wish you guys good luck and I wish I can meet everyone..  
5,輕鬆好走的步道。全家人都合適來走  
5,感覺走在郊外田野中，洗滌煩惱。  
5,回來板橋喜歡逛後站商圈  
5,蒲添生出生於嘉義市美街；他的父親蒲嬰以裱畫為業並擅於繪製人像畫（英語：Portrait painting），祖父則是畫家兼佛像雕刻師。      在父親的店裡，他對繪畫產生興趣，並開始以顧客為描摹對象。1919年，他進入玉川公學校（今嘉義市東區崇文國民小學前身）就讀；期間，他受陳澄波教導並啟發藝術創作的天分。14歲時，他以作品《鬥雞》獲得新竹美展首獎；同時，他也一直期望自己能如鄰居林玉山前往日本求學，但因家裡經濟狀況而始終無法實現。1928年，他與林玉山等畫家合組「春萌畫院」。      20歲時，蒲添生趁著替父親收取裱畫生意尾款的機會逕自前往基隆，並搭上輪船前往日本。1931年，他開始在東京川端畫學校（日語：川端画学校）專攻素描。在抵達日本後的漫長時日裡，他一直靠著零星的打工機會與父親及兄長不定時的匯款勉力維生。1932年，他考入帝國美術學校膠彩畫科就讀，後又轉入雕塑科。1934年，他從帝國美術學校轉入雕塑家朝倉文夫（日語：朝倉文夫）私塾門下；在其嚴格教導下，他練得了深厚的基礎能力和正確的雕塑觀念，其中包含觀察能力與記憶力的訓練，還有向自然尋求創作靈感的精神。      1939年，他迎娶陳澄波的長女陳紫薇為妻子。[1940年，他以雕塑作品《海民》入選聖德太子奉讚展。隨後，他決定返回臺灣與楊三郎等人籌組台陽美術協會，並在其下創設雕塑部。30歲時，他自日本返回臺灣，受岳父陳澄波引薦接下其首份工作：製作孫中山的銅像及蔣中正的戎裝像；恰巧，朝倉文夫在他返臺前贈送他十多張孫中山的照片，還叮嚀他將之妥善保存。隨後，在該些照片與其親友輔助下，他順利完成了孫中山的銅像（後置於臺北中山堂廣場東北側）。1946年，他在製作「蔣主席戎裝像」時堅持不使其著軍帽，以藉其頭形傳達其精神，並經溝通而免於不必要的爭議及政治風險。      35歲時，他將鑄銅技術自日本引入臺灣，並成立鑄銅工廠。      1949年起，他於臺灣省教育廳雕塑講習會開始任教直至1979年。      1971年，他在製作蔣中正的身像時被要求加上軍帽，否則有關當局將不予驗收。      1982年，他以法國籍女性為模特兒創作出作品《陽光》；但是，該作品不但未被全國美術展覽會的承辦單位（展覽地點為國父紀念館）所接受，其造型也引發是否涉及色情的爭議。1983年及1984年，他在兒子蒲浩明建議下將作品《詩人》（為紀念魯迅而作）《亭亭玉立》、《懷念》等送至巴黎沙龍藝術展（英語：Salon (Paris)）參加選拔並一一入選。1988年，他在觀賞漢城奧運女子體操表演後受其啟發，並因而創作出十件《運動系列》作品。      1993年，他接受李登輝(時任中華民國總統)邀請為健康幼稚園教師林靖娟創作紀念銅像；該作品為其最後作品之一，他在創作過程中因癌症經常發生抽筋或失去體力的情況。[5]1996年5月底，他在完成作品不久後因胃癌逝世於臺大醫院。      此外，他也曾在台灣省全省美術展覽會擔任評審數十年。  
5,淡水山岳協會去年一趟今年一趟練腳力芬多精負離子健康  
